{
  "id": "G1-GC-007",
  "symptom_class": "depth_zero",
  "description": "DRAFT PROPOSAL — NOT RATIFIED. ADR-0011 discriminating case A for the G1-GC-003 'Match Depth 0' symptom: no engagement history record exists for this professional, so depth is not computable. Paired with G1-GC-008 (history present, no qualifying engagements). zero_classification is deliberately ABSENT — the packet does not determine it (packet line 76). 'Match Depth' is also NOT a key in PROPOSED_FACTORS; whether it is a factor, a derived display quantity, or a renamed form of another factor is itself undecided. No expected scores until G1 closes.",
  "stakeholder_reference": "docs/archive/plans/workshops/g1-factor-registry-workshop-packet.md line 76; ADR-0011 Fix #8; MM-002 golden case",
  "inputs": {
    "_draft_status": "proposed_pending_ratification_by_danny_tran",
    "_data_provenance": "synthetic; no real professional or event data",
    "_unresolved_definition": "No factor key 'match_depth' exists in PROPOSED_FACTORS (factor_registry.py). This fixture therefore records the symptom's inputs without asserting which factor produces it.",
    "professional": {
      "professional_id": "SYNTH-PRO-0007",
      "engagement_history": null,
      "engagement_history_state": "absent_no_record",
      "roles": ["mentor"]
    },
    "event_need": {
      "event_need_id": "SYNTH-EN-0007",
      "requested_roles": ["mentor"],
      "unit_id": "SYNTH-UNIT-0001"
    },
    "context": {
      "registry_version_referenced": "1.1.0-proposed",
      "registry_status_at_authoring": "proposed"
    },
    "workshop_must_decide": [
      "zero_classification for this case: measured_zero or unknown — NOT DETERMINED BY PACKET (packet line 76).",
      "What quantity 'Match Depth' names, and which registry factor (if any) owns it — NOT DETERMINED BY PACKET."
    ]
  }
}
