{
  "id": "G1-GC-005",
  "symptom_class": "zero_or_unknown",
  "description": "DRAFT PROPOSAL — NOT RATIFIED. ADR-0011 discriminating case A for the G1-GC-002 symptom: the professional record carries NO expertise topics at all, so topic relevance is not computable. Paired with G1-GC-006 (topics present, none overlapping) so the workshop can decide measured_zero vs unknown against two cases that the legacy rendered identically as '0%'. zero_classification is deliberately ABSENT — the packet does not determine it (packet line 75). No expected scores until G1 closes.",
  "stakeholder_reference": "docs/archive/plans/workshops/g1-factor-registry-workshop-packet.md line 75; ADR-0011 Fix #8; MM-002 golden case",
  "inputs": {
    "_draft_status": "proposed_pending_ratification_by_danny_tran",
    "_data_provenance": "synthetic; no real professional or event data",
    "_adr_0011_note": "Absence is represented as null with an explicit absence marker, never as 0. Rendering this case as '0%' is precisely the ADR-0011 defect.",
    "professional": {
      "professional_id": "SYNTH-PRO-0005",
      "expertise_topics": null,
      "expertise_topics_state": "absent_no_record",
      "roles": ["speaker"]
    },
    "event_need": {
      "event_need_id": "SYNTH-EN-0005",
      "required_topics": ["artificial_intelligence"],
      "preferred_topics": [],
      "requested_roles": ["speaker"],
      "topic_label": "AI"
    },
    "context": {
      "registry_version_referenced": "1.1.0-proposed",
      "registry_status_at_authoring": "proposed"
    },
    "workshop_must_decide": [
      "zero_classification for this case: measured_zero or unknown — NOT DETERMINED BY PACKET (packet line 75).",
      "Whether an unknown topic_relevance suppresses the candidate, is displayed as 'unavailable', or is excluded from the weighted sum with renormalization."
    ]
  }
}
