{
  "id": "G1-GC-006",
  "symptom_class": "zero_or_unknown",
  "description": "DRAFT PROPOSAL — NOT RATIFIED. ADR-0011 discriminating case B for the G1-GC-002 symptom: the professional record carries expertise topics, and none of them overlap the event's required or preferred topics. Relevance here is computable and genuinely low, unlike G1-GC-005 where it is not computable at all. zero_classification is deliberately ABSENT — the packet does not determine it (packet line 75). No expected scores until G1 closes.",
  "stakeholder_reference": "docs/archive/plans/workshops/g1-factor-registry-workshop-packet.md line 75; ADR-0011 Fix #8; MM-002 golden case",
  "inputs": {
    "_draft_status": "proposed_pending_ratification_by_danny_tran",
    "_data_provenance": "synthetic; no real professional or event data",
    "_adr_0011_note": "This case and G1-GC-005 were indistinguishable in the legacy UI — both rendered '0%'. Distinguishing them is the point of the pair.",
    "professional": {
      "professional_id": "SYNTH-PRO-0006",
      "expertise_topics": ["municipal_finance", "public_procurement"],
      "expertise_topics_state": "recorded",
      "roles": ["speaker"]
    },
    "event_need": {
      "event_need_id": "SYNTH-EN-0006",
      "required_topics": ["artificial_intelligence"],
      "preferred_topics": ["machine_learning"],
      "requested_roles": ["speaker"],
      "topic_label": "AI"
    },
    "context": {
      "registry_version_referenced": "1.1.0-proposed",
      "registry_status_at_authoring": "proposed"
    },
    "workshop_must_decide": [
      "zero_classification for this case: measured_zero or unknown — NOT DETERMINED BY PACKET (packet line 75).",
      "Whether a measured zero on a required topic is a Stage B score of zero or a Stage A eligibility exclusion. NOT DETERMINED BY PACKET."
    ]
  }
}
